<?xml version="1.0" encoding="UTF-8"?>
<atwd1 xmlns:xsi="http://www.w3.org/2001/XMLSchema-instance" xsi:noNamespaceSchemaLocation="http://www.cems.uwe.ac.uk/~p-chatterjee/2018-19/modules/atwd1/assignment/atwd1_schema.xsd" code="UFCFX3-15-3" name="Advanced Topics in Web Development" year="2018/19">
    <student sno="16036844" un="g45-jones" surname="Jones" prog="BSc (Hons) Digital Media"/>
    <assignment>
        <component id="A" name="Application">
            <tests>
                <!--
 
                 Note that you should only need to edit the '~a-student' value 
                 to your own username to make these tests work for your application.
                
-->
                <!--  convert 100.00 GBP to INR and return XML  -->
                <test id="1" response="xml" type="sucess">
                    http://isa.cems.uwe.ac.uk/~g45-jones/atwd1/assignment/?from=GBP&to=INR&amnt=100.00&format=xml
                </test>
                <!--  convert 85.75 from USD to EUR and return JSON  -->
                <test id="2" response="json" type="sucess">
                    http://isa.cems.uwe.ac.uk/~g45-jones/atwd1/assignment/?from=USD&to=EUR&amnt=85.75.00&format=json
                </test>
                <!--
 redo test 1 but leave out 'format' parameter - should return XML by default 
-->
                <test id="3" response="xml" type="sucess">
                    http://isa.cems.uwe.ac.uk/~g45-jones/atwd1/assignment/?from=GBP&to=INR&amnt=100.00
                </test>
                <!--
 error 1000: Required parameter is missing - the 'from' parameter is missing 
-->
                <test id="4" response="xml" type="error 1000">
                    http://isa.cems.uwe.ac.uk/~g45-jones/atwd1/assignment/?to=EUR&amnt=100.00&format=xml
                </test>
                <!--
 error 1100: Parameter not recognized - the 'to' parameter is missing the 'o' (return json) 
-->
                <test id="5" response="json" type="error 1100">
                    http://isa.cems.uwe.ac.uk/~g45-jones/atwd1/assignment/?from=USD&t=EUR&amnt=100.00&format=json
                </test>
                <!--
 error 1200: Currency type not recognised - the 'from' value is 'YYY') 
-->
                <test id="6" response="json" type="error 1200">
                    http://isa.cems.uwe.ac.uk/~g45-jones/atwd1/assignment/?from=YYY&to=EUR&amnt=18.85&format=xml
                </test>
                <!--
 error 1300: Currency amount must be a decimal number - the 'amnt' value is non-decimal) 
-->
                <test id="7" response="xml" type="error 1300">
                    http://isa.cems.uwe.ac.uk/~g45-jones/atwd1/assignment/?from=USD&to=EUR&amnt=NaN&format=xml
                </test>
                <!--
 error 1400: Format must be xml or json - the 'format' value is 'ZZZ') 
-->
                <test id="8" response="xml" type="error 1400">
                    http://isa.cems.uwe.ac.uk/~g45-jones/atwd1/assignment/?from=USD&to=EUR&amnt=19.20&format=ZZZ
                </test>
            </tests>
            <data>
                <rates_file>
                    http://isa.cems.uwe.ac.uk/~g45-jones/atwd1/assignment/curData.xml
                </rates_file>
            </data>
            <code>
                <file type="main">
                    http://isa.cems.uwe.ac.uk/~g45-jones/atwd1/assignment/docs/index.phps
                </file>
                <!--  You can add uo to 7 addtional url's here  -->
                <file type="config">
                    http://isa.cems.uwe.ac.uk/~g45-jones/atwd1/assignment/docs/config.phps
                </file>
                <file type="errorHandling">
                    http://isa.cems.uwe.ac.uk/~g45-jones/atwd1/assignment/docs/generateError.phps
                <file type="externalAPI">
                    http://isa.cems.uwe.ac.uk/~g45-jones/atwd1/assignment/docs/curDataMonitor.phps
                </file>
                <file type="GET">
                    http://isa.cems.uwe.ac.uk/~g45-jones/atwd1/assignment/docs/currGet.phps
                </file>
            </code>
            <comment>This was easy-peasy. Did it in my sleep.</comment>
        </component>
        <component id="B" name="Post, Put & Delete implementation">
            <code>
                <file type="POST">
                    http://isa.cems.uwe.ac.uk/~g45-jones/atwd1/assignment/docs/currPost.phps
                </file>
                <file type="PUT">
                    http://isa.cems.uwe.ac.uk/~g45-jones/atwd1/assignment/docs/currPut.phps
                </file>
                <file type="DEL">
                    http://isa.cems.uwe.ac.uk/~g45-jones/atwd1/assignment/docs/currDelete.phps
                </file>
            </code>
            <!--  interface form  -->
            <form>
                http://isa.cems.uwe.ac.uk/~g45-jones/atwd1/assignment/client/client.html
            </form>
            <comment>
                A responsive form and easy code - again far too easy. Blimey, is this first year stuff?
            </comment>
        </component>
        <component id="C" name="Critical Evaluation">
            <eval>
                <![CDATA[
<p>Can be up to 500 words and can include HTML5 or Markdown markup</p>
]]>
            </eval>
        </component>
    </assignment>
</atwd1>
<!--  ATWD1 assignment XML submission File, 2018  -->
<!--  author: prakash.chatterjee@uwe.ac.uk  -->
